{
  "levelNumber": 1,
  "levelVersionCode": 1,
  "collectorArea": {
    "gridWidth": 2,
    "gridHeight": 1,
    "singleBlockCollectors": [
      { "x": 0, "y": 0, "color": "r" },
      { "x": 1, "y": 0, "color": "b" }
    ],
    "woodBoxCollectors": [],
    "iceCollectors": [],
    "deadCells": [],
    "tunnels": [],
    "pinBlockers": [],
    "mysteryCollectors": [],
    "tiedPairs": [],
    "keyLocks": []
  },
  "hexStackArea": {
    "gridWidth": 2,
    "gridHeight": 1,
    "stacks": [
      { "x": 0, "y": 0, "colors": ["r", "r", "r", "r"] },
      { "x": 1, "y": 0, "colors": ["b", "b", "b", "b"] }
    ],
    "tunnels": []
  },
  "editorMeta": {
    "totalBlocks": 8,
    "colorCount": 2,
    "maxColorsPerStack": 1,
    "heightMin": 4,
    "heightMax": 4,
    "randomness": 0.0,
    "verticalPercent": 0.0,
    "horizontalPercent": 0.0,
    "mysteryPercent": 0.0
  }
}
