{
  "levelNumber": 6,
  "levelVersionCode": 1,
  "collectorArea": {
    "gridWidth": 3,
    "gridHeight": 3,
    "singleBlockCollectors": [
      { "x": 0, "y": 0, "color": "r" },
      { "x": 2, "y": 0, "color": "g" },
      { "x": 0, "y": 1, "color": "r" },
      { "x": 1, "y": 1, "color": "g" },
      { "x": 2, "y": 1, "color": "g" },
      { "x": 1, "y": 2, "color": "r" }
    ],
    "woodBoxCollectors": [],
    "iceCollectors": [],
    "deadCells": [
      { "x": 1, "y": 0 }
    ],
    "tunnels": [],
    "pinBlockers": [],
    "mysteryCollectors": [],
    "tiedPairs": [],
    "keyLocks": []
  },
  "hexStackArea": {
    "gridWidth": 2,
    "gridHeight": 1,
    "stacks": [
      { "x": 0, "y": 0, "colors": ["r", "r", "r", "r", "r", "r"] },
      { "x": 1, "y": 0, "colors": ["g", "g", "g", "g", "g", "g"] }
    ],
    "tunnels": []
  },
  "editorMeta": {
    "totalBlocks": 12,
    "colorCount": 2,
    "maxColorsPerStack": 1,
    "heightMin": 6,
    "heightMax": 6,
    "randomness": 0.0,
    "verticalPercent": 0.0,
    "horizontalPercent": 0.0,
    "mysteryPercent": 0.0
  }
}
