{
  "levelNumber": 7,
  "levelVersionCode": 1,
  "collectorArea": {
    "gridWidth": 3,
    "gridHeight": 1,
    "singleBlockCollectors": [
      { "x": 0, "y": 0, "color": "b" }
    ],
    "woodBoxCollectors": [],
    "iceCollectors": [
      { "x": 1, "y": 0, "hiddenColor": "r", "iceCapacity": 1 },
      { "x": 2, "y": 0, "hiddenColor": "g", "iceCapacity": 2 }
    ],
    "deadCells": [],
    "tunnels": [],
    "pinBlockers": [],
    "mysteryCollectors": [],
    "tiedPairs": [],
    "keyLocks": []
  },
  "hexStackArea": {
    "gridWidth": 1,
    "gridHeight": 1,
    "stacks": [
      { "x": 0, "y": 0, "colors": ["b", "r", "g"] }
    ],
    "tunnels": []
  },
  "editorMeta": {
    "totalBlocks": 3,
    "colorCount": 3,
    "maxColorsPerStack": 3,
    "heightMin": 3,
    "heightMax": 3,
    "randomness": 0.0,
    "verticalPercent": 0.0,
    "horizontalPercent": 0.0,
    "mysteryPercent": 0.0
  }
}
